{
  "version": 1,
  "name": "Development Playground",
  "edits": [
    {
      "op": "add-player",
      "user": "user",
      "password": "password",
      "planet": "1:50:8"
    },
    {
      "op": "set",
      "user": "user",
      "research": {
        "astrophysics": 15,
        "combustiondrive": 8,
        "impulsedrive": 6,
        "computertechnology": 12,
        "espionagetechnology": 8,
        "energytechnology": 8,
        "weaponstechnology": 6,
        "shieldingtechnology": 6,
        "armourtechnology": 6
      }
    },
    {
      "op": "set",
      "user": "user",
      "planet": "1:50:8",
      "name": "Home",
      "resources": {
        "metal": 2000000,
        "crystal": 1500000,
        "deuterium": 1000000
      },
      "buildings": {
        "metalmine": 12,
        "crystalmine": 10,
        "deuteriumsynthesizer": 8,
        "solarplant": 18,
        "roboticsfactory": 6,
        "researchlab": 8,
        "shipyard": 8,
        "metalstorage": 7,
        "crystalstorage": 7,
        "deuteriumtank": 7
      },
      "ships": {
        "smallcargo": 100,
        "lightfighter": 100,
        "cruiser": 20,
        "espionageprobe": 30,
        "recycler": 20,
        "colonyship": 3
      },
      "defenses": {
        "rocketlauncher": 50,
        "lightlaser": 20
      }
    },
    {
      "op": "add-planet",
      "user": "user",
      "planet": "1:51:8",
      "name": "Forge"
    },
    {
      "op": "set",
      "user": "user",
      "planet": "1:51:8",
      "name": "Forge",
      "resources": {
        "metal": 2000000,
        "crystal": 1500000,
        "deuterium": 1000000
      },
      "buildings": {
        "metalmine": 12,
        "crystalmine": 10,
        "deuteriumsynthesizer": 8,
        "solarplant": 18,
        "roboticsfactory": 6,
        "researchlab": 8,
        "shipyard": 8,
        "metalstorage": 7,
        "crystalstorage": 7,
        "deuteriumtank": 7
      },
      "ships": {
        "smallcargo": 100,
        "lightfighter": 100,
        "cruiser": 20,
        "espionageprobe": 30,
        "recycler": 20,
        "colonyship": 3
      },
      "defenses": {
        "rocketlauncher": 50,
        "lightlaser": 20
      }
    },
    {
      "op": "add-planet",
      "user": "user",
      "planet": "1:52:8",
      "name": "Haven"
    },
    {
      "op": "set",
      "user": "user",
      "planet": "1:52:8",
      "name": "Haven",
      "resources": {
        "metal": 2000000,
        "crystal": 1500000,
        "deuterium": 1000000
      },
      "buildings": {
        "metalmine": 12,
        "crystalmine": 10,
        "deuteriumsynthesizer": 8,
        "solarplant": 18,
        "roboticsfactory": 6,
        "researchlab": 8,
        "shipyard": 8,
        "metalstorage": 7,
        "crystalstorage": 7,
        "deuteriumtank": 7
      },
      "ships": {
        "smallcargo": 100,
        "lightfighter": 100,
        "cruiser": 20,
        "espionageprobe": 30,
        "recycler": 20,
        "colonyship": 3
      },
      "defenses": {
        "rocketlauncher": 50,
        "lightlaser": 20
      }
    },
    {
      "op": "add-planet",
      "user": "user",
      "planet": "1:53:8",
      "name": "Elysium"
    },
    {
      "op": "set",
      "user": "user",
      "planet": "1:53:8",
      "name": "Elysium",
      "resources": {
        "metal": 2000000,
        "crystal": 1500000,
        "deuterium": 1000000
      },
      "buildings": {
        "metalmine": 12,
        "crystalmine": 10,
        "deuteriumsynthesizer": 8,
        "solarplant": 18,
        "roboticsfactory": 6,
        "researchlab": 8,
        "shipyard": 8,
        "metalstorage": 7,
        "crystalstorage": 7,
        "deuteriumtank": 7
      },
      "ships": {
        "smallcargo": 100,
        "lightfighter": 100,
        "cruiser": 20,
        "espionageprobe": 30,
        "recycler": 20,
        "colonyship": 3
      },
      "defenses": {
        "rocketlauncher": 50,
        "lightlaser": 20
      }
    },
    {
      "op": "add-planet",
      "user": "user",
      "planet": "1:54:8",
      "name": "Kepler"
    },
    {
      "op": "set",
      "user": "user",
      "planet": "1:54:8",
      "name": "Kepler",
      "resources": {
        "metal": 2000000,
        "crystal": 1500000,
        "deuterium": 1000000
      },
      "buildings": {
        "metalmine": 12,
        "crystalmine": 10,
        "deuteriumsynthesizer": 8,
        "solarplant": 18,
        "roboticsfactory": 6,
        "researchlab": 8,
        "shipyard": 8,
        "metalstorage": 7,
        "crystalstorage": 7,
        "deuteriumtank": 7
      },
      "ships": {
        "smallcargo": 100,
        "lightfighter": 100,
        "cruiser": 20,
        "espionageprobe": 30,
        "recycler": 20,
        "colonyship": 3
      },
      "defenses": {
        "rocketlauncher": 50,
        "lightlaser": 20
      }
    },
    {
      "op": "add-planet",
      "user": "user",
      "planet": "1:55:8",
      "name": "Nereid"
    },
    {
      "op": "set",
      "user": "user",
      "planet": "1:55:8",
      "name": "Nereid",
      "resources": {
        "metal": 2000000,
        "crystal": 1500000,
        "deuterium": 1000000
      },
      "buildings": {
        "metalmine": 12,
        "crystalmine": 10,
        "deuteriumsynthesizer": 8,
        "solarplant": 18,
        "roboticsfactory": 6,
        "researchlab": 8,
        "shipyard": 8,
        "metalstorage": 7,
        "crystalstorage": 7,
        "deuteriumtank": 7
      },
      "ships": {
        "smallcargo": 100,
        "lightfighter": 100,
        "cruiser": 20,
        "espionageprobe": 30,
        "recycler": 20,
        "colonyship": 3
      },
      "defenses": {
        "rocketlauncher": 50,
        "lightlaser": 20
      }
    },
    {
      "op": "add-planet",
      "user": "user",
      "planet": "1:56:8",
      "name": "Helios"
    },
    {
      "op": "set",
      "user": "user",
      "planet": "1:56:8",
      "name": "Helios",
      "resources": {
        "metal": 2000000,
        "crystal": 1500000,
        "deuterium": 1000000
      },
      "buildings": {
        "metalmine": 12,
        "crystalmine": 10,
        "deuteriumsynthesizer": 8,
        "solarplant": 18,
        "roboticsfactory": 6,
        "researchlab": 8,
        "shipyard": 8,
        "metalstorage": 7,
        "crystalstorage": 7,
        "deuteriumtank": 7
      },
      "ships": {
        "smallcargo": 100,
        "lightfighter": 100,
        "cruiser": 20,
        "espionageprobe": 30,
        "recycler": 20,
        "colonyship": 3
      },
      "defenses": {
        "rocketlauncher": 50,
        "lightlaser": 20
      }
    },
    {
      "op": "add-planet",
      "user": "user",
      "planet": "1:57:8",
      "name": "Borealis"
    },
    {
      "op": "set",
      "user": "user",
      "planet": "1:57:8",
      "name": "Borealis",
      "resources": {
        "metal": 2000000,
        "crystal": 1500000,
        "deuterium": 1000000
      },
      "buildings": {
        "metalmine": 12,
        "crystalmine": 10,
        "deuteriumsynthesizer": 8,
        "solarplant": 18,
        "roboticsfactory": 6,
        "researchlab": 8,
        "shipyard": 8,
        "metalstorage": 7,
        "crystalstorage": 7,
        "deuteriumtank": 7
      },
      "ships": {
        "smallcargo": 100,
        "lightfighter": 100,
        "cruiser": 20,
        "espionageprobe": 30,
        "recycler": 20,
        "colonyship": 3
      },
      "defenses": {
        "rocketlauncher": 50,
        "lightlaser": 20
      }
    },
    {
      "op": "add-bot",
      "user": "scout",
      "planet": "1:49:4",
      "preset": "weak"
    },
    {
      "op": "set",
      "user": "scout",
      "activity": "inactive7"
    },
    {
      "op": "set",
      "user": "scout",
      "activity": "inactive28"
    },
    {
      "op": "add-bot",
      "user": "prospector",
      "planet": "1:49:5",
      "preset": "strong"
    },
    {
      "op": "add-bot",
      "user": "drifter",
      "planet": "1:49:6",
      "preset": "weak"
    },
    {
      "op": "add-bot",
      "user": "rival",
      "planet": "1:49:7",
      "preset": "strong"
    },
    {
      "op": "add-bot",
      "user": "trader",
      "planet": "1:49:8",
      "preset": "weak"
    },
    {
      "op": "set",
      "user": "trader",
      "activity": "inactive7"
    },
    {
      "op": "add-bot",
      "user": "vanguard",
      "planet": "1:49:9",
      "preset": "strong"
    },
    {
      "op": "set",
      "user": "vanguard",
      "activity": "inactive28"
    },
    {
      "op": "add-bot",
      "user": "sleeper",
      "planet": "1:49:10",
      "preset": "weak"
    },
    {
      "op": "set",
      "user": "sleeper",
      "activity": "sleeping"
    },
    {
      "op": "add-bot",
      "user": "retired",
      "planet": "1:49:11",
      "preset": "strong"
    },
    {
      "op": "set",
      "user": "retired",
      "activity": "retired"
    },
    {
      "op": "add-bot",
      "user": "wanderer",
      "planet": "1:50:4",
      "preset": "weak"
    },
    {
      "op": "set",
      "user": "wanderer",
      "activity": "inactive7"
    },
    {
      "op": "set",
      "user": "wanderer",
      "vacation": true
    },
    {
      "op": "add-bot",
      "user": "sentinel",
      "planet": "1:50:5",
      "preset": "strong"
    },
    {
      "op": "add-bot",
      "user": "outpost",
      "planet": "1:50:6",
      "preset": "weak"
    },
    {
      "op": "set",
      "user": "outpost",
      "activity": "inactive28"
    },
    {
      "op": "add-bot",
      "user": "merchant",
      "planet": "1:50:7",
      "preset": "strong"
    },
    {
      "op": "add-bot",
      "user": "nomad",
      "planet": "1:50:12",
      "preset": "weak"
    },
    {
      "op": "set",
      "user": "nomad",
      "activity": "inactive7"
    },
    {
      "op": "add-bot",
      "user": "guardian",